commit_id,msg
454519220f27ff37ef78b149e9c46546e9b291ac,ui: don't run full decompilation on start
49a263454ca5d3f503e8b7058b3c6fe6ae9e2af4,update gradle wrapper to version 4.4.1
c6995c22835ab80b9cc2024784d15aea298ab750,remove .DS_Store file
19c0bbb94c9914d08f98c18a8c3bf01e60073f29,Merge jiqimaogou/jadx
4d9d0884c39db950320e2f453b8cb413b6a09ced,remove old version of dx.jar
648f0edc79dc9e3527798ff2f7e1c4b3de03958d,build: add gitlab-ci
7b9e5fe99f4b351483decda672dea444dc7eed83,build: add sonarqube
d586c84b5632be0bca22250a7081506136e8a85e,reformat code and fix sonar warnings
418546a659af54377b4b2016d42f762e7a34a9d0,Merge with master
7d3caa28755a9715af8246b7af24d868b0d045e3,"Adds checks for resources, and logs detected attacks"
965fd66e0f2111b5e1eb67495282f74d25b3495c,Adds more checks for file write ops
578122041534b977c378a389e951fdcc333b41a8,Delete .DS_Store
9cd46e74be2f202dfebed9982d9b04926e142d6b,fix some xml generate issues
ee68e04f84679cd53f9c19d6c8e43b9e3a7bb03b,GUI screenshot fix
089467a419485c37466ac2a4e00240d1f3091052,"Merge pull request #203 from dgorshkov/patch-1

Readme - GUI screenshot fix"
c4765939254578afb9aabcb533c78ffc65a9c713,"Changes MAX_SIZE_DIFF in ZipSecurity, and adds extra logging"
5d60f2cdf275c389066811d3c69858e9e9abc4cc,PR for issue #191
072b6cce36f3938730556b5b6427efd988872ba0,Update README.md
75135819cfcb4b2147f658dec55fea2176009dfe,Delete .DS_Store
e4fc3cebfd6965a5d16d3210837bbaa9f843c0ce,"Update JadxArgs.java

Changes flags to true"
9679ef893b7d83d4adb4a73ec2355d8f8c5b3721,Update README.md
b921f6097d266cf08f3f72c48fc78edcfd76cc2b,Update JadxCLIArgs.java
cc2ae80e7bd7c5cfedcb1b0a67f7cfcb347a7be8,Issue #204
5e81bd833bd9864aff7aae7671a96e8c67ccdccf,"Decode attributes which may contain either enums or values, e.g. layout_width

android:layout_width=""UNKNOWN_DATA_0x6401"" becomes android:layout_width=""100dp""."
8e418d4414ac11e4535d115029cb5caf1ae6b6d1,"Merge pull request #206 from mtdcr/master

Decode attributes which may contain either enums or values"
9614929f7732828510e9ce89cce849831f01b3e7,Fixes build issues
f30cfb61661658780ce6fd31e8bd883fca72574a,Merge branch 'master' of https://github.com/skylot/jadx into issue_204
ca9dc5f944b4451fbf9c909b4c8b57d8b14819c4,Update README.md
9278c510351f825a096e4bc5f2fc00e6946fe355,build: use commits count in gitlab ci version
f53fc03c6ca6b06ce0235b15c5dd9bdb5b5a9f05,core: use dynamic check for filesystem case-sensitivity (#158)
2cb94856fd6f8e7016871e6bc537478d7ffb1ab7,build: setup bintray unstable upload
7fe46fb6f3bf62355c1d7c139efc97c6d9943b41,gui: highlight words on double click (#210)
c4a462d60125c767214e912c54cfa458c333c5ca,"core: update dx to version 14, allow to decompile java 8 classes (new instructions not implemented yet)"
4e07d80ebc9a544dcc05d6be388e9c4df6694db7,cli: fix errors list sorting
fc4dcd2db5d9ea5e0bbb392f00fa547d75a24111,core: prevent some null crash on resource decoding
89042fbf4a8f26b83290b659141bf07d0d2f5c6a,Don't throw a DecodeException if dex files aren't found but --no-src is enabled
d42bf2d43cc676a2c10e7cdf0c3cf33d0eb1fa61,"Merge pull request #212 from KpChuck/master

Don't throw a DecodeException if dex files aren't found but --no-src used"
9132ef57f1db4d4abb07b0f0ec9c88096e9658ab,core: use late deletion for NOP instruction (#215)
f02b99a1d0f0ec150c4514a58b26d5eb90d4af71,fix some sonar warnings
20bf85b14dec5b86c7e1226a9346afe1799eaca4,core: ignore bogus opcode decode (#214)
b52f35259b73e790522f24f21f27019555f6e587,core: support 'not-int' and 'not-long' instructions
3167cd0817a586ab06bd291c5426facf92bc3c70,fix bintray upload
4bdfdfcb36db9dc4a65d0fa90337916f66c78da7,Create CONTRIBUTING.md
477222a3957b90f4afbbf3e57085d7bb23ecffff,Update README.md
035506496e7dc31db93f975d106b529676dbeb6a,core: add endless loop test
32f94b463f674ca5d7a1f7f7de58a13060d2be16,core: add code lines for while loop
948f9456f502b48d5a10476544abb5ab6ef63ec6,core: change jadx args api for easier processing and validation
d9b0365c9f1d19019ff84a9d692d84b98e57579a,core: fix binary xml parser (#211)
f0a57e6714cde83985d0f9e8db601d67de70e685,case insensitive option for searches
c134837ca60884d4dee5d1c55be0933012ccc106,pagination for search results.
a7903f31ac4b3a4853b0f09589419cdc61f6548b,"Merge pull request #228 from jpstotz/master

Search dialog improvements"
a2781b5bd3406f1ec0c35d3c79f4572b8ab42b76,"Merge pull request #221 from rgoggins/master

Move contribution section to separate file"
ab040d36d5238e519738e4c1635d82d705b8ba37,update all dependencies (#229)
8446d016e4b78d6f284730e3780067f9102ab2da,cli: update jcommander lib
6047a27c89ad9c876ab52fce3a701e6142284bc9,build: disable codecov pull request report
6fb1c8d3b9d0071f6191c1fd47796c9f7ecdbccc,gui: don't decode resources on file open
c25f918cc52c591020b4710bb4fbadcc2ab9417d,gui: fix some sonar warnings
a046f1caec356fdd58dcc9666e9102c6e7b46032,core: ignore dex loading errors (#233)
c410914208a30471884357a4f6e42e95f371f287,core: skip finally extract visitor on error
b39d79a0f91e0fd37a28bc1251c3877e7ad6024c,remove coverity and downloads badges
1f3aebf584687c162cabf572e5f78d0bd5be5032,res: close tag before cdata (#231)
f91c5d3647473ef7eaf2a40bf67887e0c31db595,res: skip padding on file end (#225)
fd2dc14edece2ab2596e148c8277beeb1c2f602f,"Update ZipSecurity.java

Changes max diff size to prevent valid resources filtration"
1356d91423f98b53a77b484d9b66cd69db350573,res: don't add colon for empty namespace (#231)
1085238031f184f3771d2641ed5a0e1a91808607,res: don't use system locale for number formating (#238)
2cea653249fdbda3804d4a27a152f27f2d299251,fix bintray upload
1a736aadf5ed2b34134a28479782931f5d73cdf0,v0.7.1
05ab8fd868ab3036f576c4d164eafebb7fc2e308,bump version
aa8a298ec75dbe69b0bc0edbf2aca712431cfd91,remove sourceforge from downloads list
882af0402797effbdb418adcf2cf34526747e8d7,Encodes XML attrs
37ed9cd25baa66e766fc8fe5b0d4e57964af13a0,core: make decompilation results more deterministic
15e1e1dfabaa80dffdc3a7940cc15d9af0cb93f1,build jadx-gui.exe
ea01102f1ddc204487a4b32f9c8ccc0a8565ead2,gui: fix decompilation task on search (#235)
54fbe8a7c08b5670763820c9e66e515fbcfc2b78,remove -d64 option as java 10 not support it anymore
23553c994459cb1bda8fe2ec1492c59039f3d278,cli: fix missing spaces in help
7a168148080b837dede26feed30d29ac4b847fb9,core: fix class file loading (#249)
cb23b65797bc2effde4a421a4d6b4f4eab9468b7,core: fix variable names propagation (#219)
9c6c18780f76dde7299461c96e3effc09433ccb0,Adds define of unknown NSes
1c352cc81b42ad60d5d9094edd499beb936a636b,Fixes bugs
2e5d73a7e4c509b09357e055230cc6c4eb2f291b,Fixes bug with NS declaration duplicates
d5cfdfb50dfb38a65f1709cfadc1628ff32e546d,Prevents command injections when opening links
d805ec15b4db1273951f8f8490ae3be4b7648393,Adds more escape for unreadable characters so parser won't throw exceptions during parse
b29223c5b6a91d49d4fe055dceb7090ec101e91f,"core: fix enum processing order, remove synchronization (#257)"
3b2d595a068a4bef192f8c72768411ef374459ec,"Merge pull request #255 from skylot/xml_unreadable_chars_escapes

Adds more escape for unreadable characters so parser won't throw exceptions during parse"
0e4c8df4183a91e6aad2a7e2aec79e09bfe1c90b,cli: print default value for number options
a3b961e72f159b4b610608d5365eb2175b315d87,core: fix method deobfuscation (#241)
2c904c56f45182f93f48471750b171066ae34dd2,"core: reformat imports, fix some sonar issues"
9e9270a8b7b9c32d9018d1492d4ff01125061ae0,core: fix type inference StackOverflowError
39093130a3b0282a7aba7f0bf321019cc02f38d8,core: fix processing overriden methods in deobfuscator (#207)
20bfe838495639e00ecf05fe24b411ed72aff406,core: fix null pointer in code annotations getter
412a185fa1aee55024c97344ed6ac339ef58aaab,core: fix null pointer error in try/catch processing
e039a5a9af95c8e9f9f56a9056eedf344ee763f0,core: don't process debug info if offset is incorrect (#259)
98ef7c39b73adf3e41493ac51b1565f4393b04ef,core: fix synthetic constructor remove (#265)
7216635d8438195bd559881b313e35df92385a2d,gui: run text search in background thread (#269)
5006b3e8371935a94af4b81cdc2869c20d397c1c,gui: fix cell renderer in search dialog (#271)
398cd15dcf9538c3b691ac98c6f1aa5381d3a437,Copy XMLChar class from Apache Xerces library. Replaces all invalid (obfuscated) XML tag and attribute names to random ones
8fdb473d781cc2ffa50f016c7e316b5e33353fd7,"Merge pull request #280 from skylot/xml_tag_attr_name_validator

res: Copy XMLChar class from Apache Xerces library. Replaces all invalid (obfuscated) XML tag and attribute names to random ones"
3556e591b0df283f6361fa787bba20b909313c43,gui: hide deobf options if not enabled (#281)
6d984c0407cd6b252732869c504c997253dda13c,gui: update default settings
7562ec9e1a3c6525321383586a1cb2c4fadf3877,tests: add base test class for simplified apk debugging
4f02864e12dc16dbaa7f5985a51338abd22aadc9,core: fix variable declaration in else-if chain (#273)
90692d89c59c1ccbf0a99c7992bf6f009dfcb664,Xml deobf 2.0
1931e7836744beeaa9c8676544d26a645661cfb8,"Merge pull request #290 from skylot/xml_deobf_2

Xml deobf 2.0"
6df315017ce5d58b37630666405331107d460074,gui: add Hack font
8445ebf10719ec6c666a554b88b29fc26f4c3b38,fix sonar badge
a27cb9c34e084cc0bfc1aa288626645dbe7e4f4d,core: bind blocks for target instructions at early stage
7b6825d85c2636e7b270ca432825b5113f3f65ff,core: move same instructions from predecessors for loops
188bfd1a7e1087067bf93b0c042473a9ecf137e4,core: fix endless loop processing (#275)
7b4321ecee403c6c73d538ff32c150f8a92e4699,gui: fix build for java 10 and update dependencies (#291)
d20cd43a99e535107acb6ca024f70bfcfb2e9516,core: fix loop handling
0a0c4eac88e5dfe4c213eb4e51d3eabd52c2c085,Fixes errors
3b2b5417aa0583e3b860be17f7fa7b16d0fc3b93,"Merge pull request #292 from skylot/xml_bug_fixes

Fixes xml deobfuscation errors"
7d983f284726e36e42e941b85044c227e6bb790c,core: fix catch block argument if move-exception instruction is missing (#295)
45f5e0cb048b39ac9979922533b4b2dbbe2b2a6c,core: prevent endless loop in region construction (#267)
ee74c4d87086be917814a3cdbc4994da7e24323c,core: ignore debug info with bad variable names
4d305107061b38d847b8194d466e3e499f4f7efe,core: fix line number references
10fd3652d490c9070826cc2ccc9f1685a08a4e87,"core: fix processing same class several times (#274)

Caution: This change can increase memory usage!
However overall decompilation must be faster"
4e2e5aa9757feb72d12639c5567200c1495d8c69,"gui: fix colors to match system theme, add editor theme selector (#297)"
dda49f15018585422b1609784bfccf8643588f27,core: fix enum reconstruction (#272)
6e50ddf5c847cff8f6f8a4467caae1de4df410a9,Generates and saves public.xml in apktool style
ddbcf8bb194d57a69ec390ca0ba86f85eca4b839,Prevents path traversal attacks thru rc names
53fa8205f27db2993aafe75c7b0a49329ec51adc,Receives canonical path in ZipSecurity.isInSubDirectory(...)
c0b2230b0bfc8495028ae1404dc92db4991e2f03,"Merge pull request #299 from skylot/public_xml_impl

Generates and saves public.xml in apktool style"
45b37dcd1058f6c744fece9bc9852e96168a0b89,core: fix class name checker execution after deobfuscator (#286)
61684ea73d525e4a5a104928d9419363d44053e4,Prevent adding duplicate ids for resource entries with different entry configs
22f51e1a289ef240d6ce3ce12aceda3aa5b7b8ad,Change display style for resources.arsc
5d7f2c706cad9873a5ddefb69e0a27a7a437de05,"Merge pull request #301 from skylot/public_xml_no_dups

Prevent adding duplicate ids for resource entries with different entry configs"
5b712e8dbcb2f8bb4b81fa15d551a72d3c4cf7ac,core: fix inline of anonymous obfuscated class (#122)
2cf6a9b69130a0b97e89a1ae498956a4b2261ed0,gui: fixed object reference holding by LogCollector (#302)
03a09debfad5fe6074878bd5d65bf4c217718261,"gui: show app certificate (#305)

* add node

* add node

* add certificate panel

* add certifcate manager

*   

* 

*   

*  

* start tests

* more tests

* signature test

* fingerprint test

* public key test

*   

* add scroll"
c5994f954ae67458997641d1fcf3a0d677e61ba9,core: fix NPE in signature parser (#313)
a959af087b343cff3a2905fdf9c76f7e3c70d133,core: fix replace target in if instruction (#317)
edc1e5fa84e35a42ff8a631578d255cc7ae93f00,"gui: show the certificate if the certificate file name is not standard (#315)

* show the certificate if the certificate file name is not standard
eg https://play.google.com/store/apps/details?id=com.kms.free"
9752ec2655b77e6d54158593d8ced1bf8cc486c9,core: fix duplicate regions creation (#314)
156e54c77f2a7150f527b9cfd9d7ab0e1d7b8550,core: exclude inner classes from class dependencies (#318)
7e462e800f9fc92a4b9b216a01683bf65416c582,update gradle wrapper and dependencies
6e358d3eabdf94b91a345ae193004ff506e0b997,core: use own immutable list
2433a7e89c0f1214c8ca4494b68a07a3c95fa5b5,core: fix exception handler jumps (#320)
fdaf8492ef8b7dfcdb135f3abbbd8b8124195e5a,"Performance issue when building strings 

Improve performance by using StringBuilder instead of StringBuffer."
1ec041a48f8e9b8e3cb6562be8565103844cbe88,"Directory Bug 

The correct pattern to make a directory is: `if (!dir.mkdirs() && !dir.isDirectory()) { error }` mkdirs checks for exists so the exists check is redundant."
a50258164011422600bd6077f43c9433635fbf49,Making the Classloader threadsafe
3bf93f1f855165cada3e4acd4c9e1b379aa37e13,"Merge pull request #323 from FlXME/patch-2

Directory Bug"
1213ff26b46c49be52eb012f9ad20829258d6fef,"Merge pull request #324 from FlXME/patch-1

Performance issue when building strings"
160ad64e67a287158f847d7d76a5955b1facafde,"Merge pull request #325 from FlXME/patch-3

Making the Classloader threadsafe"
b83e20b571f9023484d341ab858ad48b6cda40ab,core: improve immutable list implementation
ea1c1eb80329671db3016eaaff57a4de334be2a3,core: fix insn move check for field assign (#326)
feeafc407a81d115188433d7cc91f319d7e532bc,core: exclude inner classes from dependencies (#318)
b861151f63a20d3e148001786bb54106446f59bb,core: rollback finally block extraction if some blocks not removed (#327)
fad0091d8764e869352b440cf38b2c61717a68fd,Prevents generation of NSes second time in wrong place
9a4e8bdb483d5b53c271c68d48db943362ec4ce5,set default deobfuscation min length to 3 (#332)
eb2e5e3da5d9a6233e1a97028b98884a7a55cf79,cli: set lower java starting heap size
ea9f933f9e40b0b56ff92c8ab3cda3457cd6e99a,"core: fix register arg hashCode method (#321, #328)"
6cb14a1c50029819e02634977b9ba78c14b7b5ff,core: use flag for mark 'this' register
f9e7a29c0840df8dcb9783ee97df191a51bfa0cf,core: fix sythetic constructor replacement (#334)
4d3f2740ce6e35e2e6f7ded6d7f78e041b38128a,Language switch supported
904f0a1197eaffb1d7da2d26335f42a61a8742d1,A subtle bug repairing
56798e716a0da199ad275d8c5944f8227e0623e4,gui: min and max deobf lengths must be positive
a9251de1dd37f9abc0a15bf19f0efb12dd501228,deobf: prevents overlaping of class names and packages (#335)
cb1359973951f6c7f811a094c8100eae24f2e326,Upgrade Chinese translation
0ae7c1efbf8e5a9551a9f93a070775f3a2f0868f,core: rename wrapped synthetic method (#336)
eaaeb2c84337cb6e77a355dcebbe420f0f051da5,core: fix return block split after try/catch (#295)
d7ce41e7246deabde1cddde91dccd2e346827923,core: don't remove synthetic methods with some logic beside casts (#336)
dc578f98e771cffdab3db87bdeb6d34b9566670b,Fix deobfuscation issue
39899e4edc687031244c895c2a89090290246a1e,"-New language: Spanish
-Small typo corrected on a LOG.error String argument."
ff7df3818fab27739d958259e21f5df3b7db90c0,"Merge pull request #344 from JaviLukiOfficial/master

New language: Spanish + Small typo corrected on a LOG.error String argument."
bd05be6fb636e01f4389ec681c9ecdacd44be913,Delete some changes
ffe739b7eb32ae5515d4234abf0e4ed073b18644,"Merge pull request #343 from Donlon/master

Solve unreplaced fields names when deobfuscation is on (#241)"
ecbb53aaeacd894b05f975e76e30f9eb5b539ebc,core: fixed 'this' attribute propagation for move insn (#345)
0c041120f679d59e6ef15554014cb818a074803e,core: show all decompilation errors in code comments (#313)
7492889f4e69ca89e83a2c3bab267bf18d3fd40a,core: prevent endless region processing (#340)
156e4209f98946a28be78a1dd4565383c922ba0b,feat(build): use semantic-release for automatic release publishing
6250ebdd7590e6f01dc468a1c28695e7aaf934e7,chore: don't use labels for artifacts in github release
1b0b526822faa507be11b1b3cfc6df75fb294f83,chore: remove 'v' from version string
a8febb2447783430a6f84666195eeab10950dabe,feat(gui): add a menu to copy class name (#351)
912f3c8467376e6b2259365e7adaa782af911740,build: skip gradle assemble before build
7bd428cf6d17874631c37c9e874accfc94a931f0,build: fix gitlab config
bc3af8e64d4c9c1935de1c4df6a36bea47273d5e,fix: resolve some sonar warnings
b587b6d694cd295f07badf57d52f0e9b884f83f6,fix(gui): use correct font and style for certificate panel
9e24a5abeb5357265474a7dda0bb6ea910571fb1,fix(gui): show 'copy name' action only for supported nodes
8c43e7f7cec36ba4dd3b17359cb7505678e98844,style: fix code formating
5de4d0792fdad702bf16345c915b8d61ba1a5641,fix: generates code of missing R class (#353)
f6f883b9d121250d18572734c8831c76e284a161,fix: change resource fields generations in R class (#308)
9be62fb16ec1c32aacb069aaec91bf59aecf76b0,fix: lower regions count limit (#354)
2de86b6db54f9ccf2a95d3177ec7141809028cec,fix(gui): make correct size truncate for recent files list
87f50ab513722c2dbcaaf111b49313dae972883b,fix: exports resources first (#376)
8eef4a907557da9e4f20926df9fe9a0e0b633ef5,fix: saves all resources (#375)
57dd9e6146e0d15eb51a5c127fb0ea4244d14c21,Removes useless imports which prevented gradle build
778b9bb8516b1ef36824a0a76d7173695c9cacec,fix: resolve lint errors in resource save methods
3815d30fc198018d7ae04bc39ba3d0018e8e2254,fix: force rename fields and methods with reserved names (#364)
8c348c935c18351dfb4fedcf7d4a2a05132e680f,build: disable travis build on oracle jdk 10
df9ae295db40a051fcd5e8f94454353957cc8544,feat: make the import class name clickable (#378)
a8a31643f1f4f99659c52fc4a7186fc14c318bee,fix: Fix for #377 (Jadx in Windows open with list) (#379)
a3464d71846439b33fee1fa2d59fbce911d6909b,fix(gui): make link for full class names (#378)
58993b9799091266aad196bf0011fc5208cd2cae,fix(gui): apply render hints for line numbers
bc629337d67d49c3b11b14498f48ff244a9402ee,"fix(gui): add ""use imports"" option to preferences"
6b3e8f083c06aef2f8eabe5cfe507db8cf29aab8,fix(gui): override settings by cmd options
1d7bb43dfd04323a51310fb563cf743260af6089,fix: correct code line number calculation
557667b125df98d050a00b29ad59f8d343c7b391,fix(gui): allow partial settings sync to not save command line options
0abb51c87ae76b18b676d727154ab8c678edc71f,fix(gui): on settings reset run upgrade method
47917fd5c2d54aea8f14a1c981f955495a010837,fix: resolve some sonar critical issues
bedbf94b4ad9293d6625590d6f7779592f9d61f8,fix: update dx to version 16 (#369)
5281eed1a509bf1aaa040ccffdb1aeb3f12dac6a,fix: loading of i18n resources as UTF-8 (see #363) (PR #386)
20b03aa755251c640e7219e47f214f8996bb70a5,fix: don't remove synthetic method if args count or name not same (#361)
850bd969764210b9feb55c1b1d78153cdb2dd215,fix: don't remove synthetic class with inner classes
1fc92d2a16eb15e6c6e14725db4a04bc3f10631c,fix: instruction deep equals must check result
3a798cb21c82cb363bac3fb97c4a121fa081c71c,fix: return type lost after type inference (#396)
6d59f7716599fec52c440d8a2f40caddf47f6d6e,fix: process try/catch without move-exception instruction (#395)
21e11c1d47d955d6316295f67736d4b6a89114b0,fix: implement new type inference approach
95f9ab035db6ec0e9ed67eafaef8d48b73f12304,fix: inline constants in chained move instructions (#399)
d553157bb31fb552b0f5506d773db7ad70536596,fix: hide debug type inference logs
87c123142245f5f787238f169ec46bb95502b5e9,fix: show type inference errors as method comments
37071dbaf3d39723930552e6eba861e14e917e2a,fix: use soft checks for objects and arrays in 'if' type listener (#401)
7e8435ccebc6c9003f509667eb3cf0a1c05681a9,fix(gui): fill background before draw line numbers (#404)
b9fffa149be2e47b150d340645035ea441d98a17,fix: allow override type with wider one only from debug info (#403)
995cf2ad421b6bc2c9734854b4c32a45b2489f45,fix: use types with generics for overloaded method casts (#402)
e0624ce986cc9a3ff55264709fed6aab6416afd9,fix: use '$' as separator for inner classes in .jobf file (#415)
5ad082627fca495c21fd6a82b64b5a5569a72676,fix(gui): fill background before draw line numbers (#404)
ee6508e93c67c7c123a526cc95feed0c34c1a3a5,fix: use '$' as separator for inner classes in .jobf file (#415)
6a1717a6241f5aec3c9d5a18b539fccea12f1a9d,fix: use original call class for invoke inherited methods (#413)
a841d0ebe7dfff6639e3eabdd8ae7e79d6a35321,fix: use '$' for inner classes also in methods and fields (#415)
0f27eba1b1c7a4de391df7cd50d75b6cae6b9a06,fix: don't rename constructors and class init methods in deobfuscator (#415)
63c528dba9abfda10e1be3618043dcfd9c3b9a80,build: update shadowJar for build with gradle 5.0
fbf750f58878a9a48c28142777bc92a845b12300,build: update jacoco for build with java 11
e9591efd7e9d504ec40661b904c653851307e6f2,fix: search exception handler splitter block by offset if jump source unknown (#406)
eadf046b2c08f8188adebee4915fd2108d5043e9,chore: show try/catch processing problems in code comments
76cf4f053fa2226bcf98c9804a4f644a3a7ebedd,Merge branch 'master' into type-inference-wip
2dea6f55b57fc9a185cbc735d6470315bfb61656,fix: add more details for variable with type inference error
1ac2cdfc411de23d13e6b2ab3fce43b9dd9a6033,fix: wait time for background jobs too short
43de744c8882ff67090cbba694b9fbf182452f9d,fix: don't reject type update for generics
fd3498add6d830050bc8abb1d26325964e24d263,"fix: show method alias in ""method not decompiled"" messages (#410)"
f60bb6b121d9009e025a6f5839cbb34e0825210c,"fix: various UI improvements (#419)

* fixed wait time for background jobs
* enable multi-threaded decompiling
* added preference for excluding certain packages from decompiling and indexing
* show message dialog in case classes are not indexed because of low memory
* added heap usage bar for visualizing Java memory usage"
ddaf0375dc4e69ee0b66cf9572770bd6bcee1725,docs: add pyjadx link in readme (#424)
1272ae2d4dcc6c48fcabcdee493346192c8a9b8a,fix(gui): don't skip indexing code lines starting with '}' (#426)
a932c7c569de17550a9d00768f57939a31c7fe21,build: add java 11 to build on travis
727285e3dfcd64a196f60e47c9308fd15ee281f5,chore: update dependencies and gradle
72b2663949555b03aeb864775d84f163b91bcea7,"fix: ArrayIndexOutOfBoundsException in string concatenation visitor (#427)

* fix: ArrayIndexOutOfBoundsException in string concatenation visitor
* fix: typo in comment
* fix: StringBuilder chain processing created wrong code
* test: simple JUnit test cases added for testing StringBuilder chain processing (chains that can be and that can't be simplified)"
7c353a6c6f056a058a0fb0380f0ea00936b1153d,fix(gui): unsynchronized search index creation results in NullPointerException upon performing search (#429)
41ee57a6f7ab36848e17413bfe128adc6d34528a,Merge branch 'master' into type-inference-wip
4e990ae2b055fcb70c084ff6d721353262546535,fix: safe SSA variables replacement in filled new array instruction (#399)
618b014b3dfc3f71514b50ac95054e382d15b104,fix: rename method wrapped by synthetic only from same class (#430)
d8b39c2698a67d7ceb0f79e389cb4cf6cefc343d,Merge branch 'master' into type-inference-wip
d1af75122694aef279d102e60376025f2e95c0c9,"feat(gui): APK signature check v1/v2 using the apksig library from Google (#431)

* feat: APK signature check v1/v2 using the apksig library from Google
* fix: proposed changes implemented"
9e0cd2e14e858ee5b86dd2489000a5e3be2d6d26,"fix(gui): add synchronizations to search index creation  (#433)

* fix: unsynchronized search index creation (code usage) results in ArrayIndexOutOfBoundsException and stuck at 99%

* fix: use computeIfAbsent instead of synchronized block"
da41efa3db7f8f2c978667b5c3a74c3398e9c068,fix: force rename by checks from RenameVisitor (#432)
b0e3cfedf499aaa83cb88c48d48ebc60a7fb044d,fix: update apksig library to latest version (#431)
aec986447ed3c90acc54d888f155275d882a66b0,fix: support multi-exception catch blocks (#421)
ffedaea50593826164084f9bbf2cf06500a49352,fix(gui): limit the spare memory to max. 512MiB (#434)
bcaca781b176c14d96e961d608fafcb8a4574b4e,style(gui): reformat code and fix some warnings
82d0d622a8e3a588b8916ecdb7b7e224551dc3fb,"fix: refactor, improve performance and fix some issues in resource processing

fix(gui): instead gradle export was executed normal export
fix(gui): content of some resource files was not shown
perf: direct resource files saving without full length buffer in memory
perf(gui): line numbers will be disabled on big files due to performance issue
feat(gui): click on HeapUsageBar will run GC and update memory info
feat(gui): add more file types for syntax highlights
refactor: ResContainer class changed for support more types of data (added link to resource file)"
293161720283284bfc2ccb3d9e333ebe9d812b2a,fix(gui): use editor font in files tree and fix bundled font loading
be509c71043f26c74d41f110eba824fe0c258026,fix(gui): use editor font in search node column
b28eaa1a94e1ccb558839debbf8c8ada2b9c6dd7,fix(gui): add synchronization to SimpleIndex class (#435)
f8c0449d4e43d9c66cc95de6f83af466a6e76239,feat(gui): add icons to jadx-gui (#420) (PR #428)
c705f8cbff9ac2d846b6b21d0a40601668afd213,Merge branch 'master' into type-inference-wip
bf42b975809c24db3bd67ddc3761caeea5a7272f,build: compile for Java 8; enable G1GC on Java 8 (PR #436)
21acaa8d37876981267989bacd9fa75261ca72d2,fix: resolve mix up in SKIP and DONT_GENERATE flags
7b14e322d33b43868eb77eac362ef09b40aae85a,test: improve test checks
9b091b7c08e558f6d8c46ece32dd137031c029ea,fix: reimplement variable declaration visitor
