commit_id,msg
29a137bde34078dadabaaec4be494cce31f712c2,fix: jadx-gui.bat and jadx.bat do not work (#692) (PR #694)
436e86fdf229a12ab1540044771edd43ee13fc0a,build: update gradle and dependencies
c10a30346b179c1c72261287c5d957b4944c6a38,style: reformat gradle files
a7247e8a888506e9f744213ac3e7014e48a1c580,build: remove unused test-app submodule
0f5fd4e48abbbc3a508082fdf209c1c499939330,fix(gui): update Chinese translation (PR #697)
c6c54f90dc31d5a784828906ef25666675447e4a,fix: comment out instructions before super call in constructor (#685)
533b686e0b95012e42ccb9e1ff29446a71568eb6,fix: comment out instructions also before other constructor call (#685)
8410e625317e73569abec394cc6fc95e9bee84ea,fix: force one branch ternary in constructors (#685)
424a8ffaf4a123beba126c46960c1433c879a67d,fix: inline constant strings (#685)
7f4da306c922861b30f3221e1975b734716562bb,refactor: remove cloning library dependency
850df18d7c47cf574912075076328a01ef7ed5be,refactor: update duplicate methods in InsnArg classes
ed8c6626317844f0804876269e30ce998e14df7a,fix: add generic types propagation (#695)
3eee83c2f28b955fffd4c8d3d3e9613b2af85770,fix: adjust insn reorder check in code shrink visitor (#695)
c3f7a049d829b8e08db9cd5a5636771789e3b5b2,fix: ignore incorrect dex files in apk (#700)
f57dfb3f2ec4181f2e767b82cdb2e24d1242c8fe,test: check method override with generic arguments (#701)
e4fc6774b1747d63ff29d98bbc79da0c6873ef7c,fix: make correct hash calculation for GenericObject type (#705)
12bb63237155b1aebc7b64c481b776286d5c73dc,fix: always cast null objects in overloaded method (#707)
0c5a83c0210f179fd1388620075c8559ea1cb68a,style: fix code style in test
a530371b6fddfc228090fd299fbd826f85ee7a62,fix: improve StringBuilder elimination (#704)
a587ce88ea8919bf73f79406b9605c2046cc8820,fix: ignore finally extraction with only one 'if' instruction (#709)
49e234d9f8ca12bad656762df27d76c3f30cb4fe,fix: improve finally extraction
ed9fe8a57321d49d3fbe1bb5fde4c799ee859ca6,fix: incorrect init values of inherited fields
fc58022d561f7bdbf139790c950d288da15d180f,misc: show shorter exception stacktrace in code
2dbdd1f0794f01362ba10856a60b2150fdd6bd24,fix: support instructions removing in SimplifyVisitor
92e28326a4f5ba68485d86d6f7f29c397d46d883,misc: don't add same edge insn several times
c555cd082552c04dbf48e6b62820618c4594df8d,fix: rename packages with reserved names (#711)
0c2784bb42ec906a0877f22dcf39458a92f106c1,refactor: inline fields in arithmetic operations
8e8a2faa1073e6d7fceabe99d223a9553a1d7506,fix(res): skip string if parsing failed (#712)
f9f840fb9db5de58e12bbfe561f01931fe97c321,refactor: remove redundant FieldArg and change arith one arg insn
d89ec67888fc86a82eb7d26d06a4689f8499f321,style: resolve compiler warnings
15d56abeb659538f793e6e16dade3ce4e2f9e121,fix: read correct buffer size for string pool parsing (#712)
aad2d24c589c49749410315d859412f6a8c62b16,fix: unbind unused ssa variable after ternary conversion (#708)
24dc68652ef340c066df6cc34676807466c06fb2,fix: check that iteration variable in for-each loop not used outside (#708)
7fd959e6e388526d7a053eecc9ffbd20f0311a0d,refactor: improve variables handling in instruction wrapping
3bc9671905162f0ded4fe249dde7e0032fd9e98c,perf(gui): speed up line numbers rendering (#714)
c8df26f227bb9d102225e19c9330da074116f219,feat(gui): add class links for AndroidManifest.xml and other minor fixes
7c53b985cd64e6e7c84afde88d1bf878392cce26,refactor(gui): remove JCertificate node
b32dc17dd737d2e2c2c417b652db6e69d0e98635,fix: don't change AST before checks in ternary transform (#710)
c8de7b97ddbd0becb8a70fa27be487842b3dee27,fix: instead commenting move constructor call to the top (#704)
9fbf9ef667c7b65109637f7b83b6e54128459944,fix(gui): compare files extension in case insensitive way
6b76a3c78718a247ee9b900ee27928c73fa097f6,fix: protect method from second load
3ae8359408de8f20d65e0a77420a0df32c6a08b3,fix: improve exception handler remove (#703)
fd7d08cb1093f8d96fc817b1aafa5f80288d0990,feat: initial deboxing implementation (#717)
0911b2dc2fdc00ccde112b556935bd63ac8c0f08,test: NYI test for issue #722
ab97084058245992e909131348516cee8393513c,refactor: move passes list to root node
472aa527067097f8e966c41050ae22184fc7f57a,fix: resolve some multi-thread issues
ddedb8d8a00c038780d967bdaa52e00d4d310ba4,fix: don't override type of method parameter in const deboxing (#723)
1e6b30343c5309eae3070f101c63763f8066ecf5,fix: several improvements for multi-variable type search (#720)
e842e022ba606760f1b948786dcb417ecc18879c,fix: use nice name for 'package-private' in modifiers change message
8d68d409eb9c27f71d53b54e4ee4c879debf17a8,test: another deboxing issue
ccb8ed1394e57966aab79f1adc177ccf00b59cc9,fix: add assign for inlined getter methods
068234f0cab197a476cba5b30592aa4d88c50249,fix: remove synchronization lock for code generation (#726)
46290437211f33456a6a25b2ac8b90cc2a79ea37,fix: convert inner enums and fix inner classes reference (#719)
be9dae57b9257536b0eb206ccc8ff52e9343e9f8,fix: add explicit cast for byte literal in method invoke (#719)
99935bada622cce2523124ed35504d4ff6779a3c,docs: update readme and contributing rules
7d07fb0b77a1c7e18f89cafcc24073d60f583c77,chore: fix issues reported by lgtm.com
a17f9136dd495df4c9bd301b3297153e5d166b98,refactor: enable class unloading after code generation
cf5bfc297b1eb8d63b7768f1983326764b0f3fc5,test: fix regression for code auto check
19ca8a096b902cb5e10b2383a4189fda7d7652c5,chore: resolve minor code issues in debug info parser
c0194d025d2a946abc2630bbe0abc54535395d78,refactor: fix misuse of immutable type flag
bc7a74842025341df264caee6166e78d750bb7b8,feat(cli): add options for change log level (#735)
7bc01dcfa89d4b7130c879db531972182b76df89,fix(gui): ignore mouse click on empty space in tree (#737)
3578f7d68f951a876647dc8bc32d82d44e032bad,fix(gui): use editor font on tabs
ff5f6fca3c0b2dd47755288153d90140148d451f,"fix(gui): fix ""Go to declaration"" and ""Find usage"" menu actions"
99934b51006e3f90b96a348311310dbee73d61ae,chore: update dependencies
a71bb7a532254ac4431b2cd5fd1ea544ada43943,fix(gui): yet another fix for broken find usage action
06f26ef8f5603f42bc26a4935246bea632e366d1,refactor: use enum for wildcard bounds instead of int
db2b537380f5e268b50961e7f70e00389af144b0,fix: try to resolve generic type variables (#662)
ba17f7bc00a15daf16f14c83c1e410357c94097c,refactor: move type with outer generic to different class
401d08ea4955a0a8132047ec04e6cb9e99bb4c0e,refactor: move all smali libs usage to one utility class
1cbaad3ec982032de96a4a7f34033634cf2b7ca0,fix: make correct class members loading in jadx api (#742)
db892adf343c03cfc19325df014732dae2d14c63,fix: don't run class process from visitors to avoid deadlock (#743)
bd9e1096cc6b7efc9884c4f551f21130b5fa8463,fix: handle methods with all NOPs (#744)
902247fcdb87e6284778c3ea91ef67674cde751f,"fix: don't stop loading classes in case of an error (PR #764)

* fix: don't stop loading classes in case of an error
* style: reformat code"
d3ecc1f640cef5d0c708cfa68360e0523715e011,fix: add dummy class if class loading exception occur (#763)
00f5e835062049a42b3ebe1dcf05045af16352b7,fix: handle incorrect args count in signature (#763)
d1ac43de33aede078592eed864da88540d9c4af1,fix(gui): add default contructor for classes serialized with GSON (#752)
3249a5e0bcb2840d0ace57509a84f8bce892f411,fix: workaround for IntelliJ bug on import line in build.gradle (PR #766)
f228a72118c25ad530b7e816006d4f67ef732d33,fix(gui): fix search if class contains not generated inner class (#755)
9f06d6744e980cfddfb9df5ddf2d4812d5630d76,fix: increase region iterative traversal limit (#767)
08f9a90c95e6ca03e8ba51f5c71a8ae86cf4b7da,fix: force cast for null args in method invoke (temp fix for #724)
64c9ce2ab0fa203c3f0b42d056b2c427e56760b6,build: update sonarqube
8321d5e3806e83dd103ad278f197f938520f0980,fix: preserve arg type on PHI insn inline (#718)
1b60c1d1a8a0e65237b1fec8abbea347de395127,test: print smali code for debug purpose
11db454b84044d45e73b34e9c5c7297974a52e14,fix: duplicate result arg on instruction copy
bae36f9720a31d105f0c88a2e855823bbb249519,fix: merge const block before return (#699)
cf3e17c4b83b68456cbb6c6802f10e57ce355512,feat(gui): support APK signature v3 (PR #773)
a48ce296b8b291aff4746627967f3bcbf71efb33,fix: resolve code generation error for interface methods (#775)
4b314e9d9943366256383f6d18a1c44a4ace340a,fix: don't eliminate StringBuilder if no String arg present
e4e6f37949066d75f6f122cd9407eae3f10d4b17,fix: sort inner classes and methods by source lines
87504dd2cc306fae3dab43d89539d2d4ea6ce39e,refactor: additional checks for ssa vars and registers
8ba3e935a5c67c6ad0688575c21a035e8d24f04b,build: update dependencies and gradle
600842a1a6fc19dfdac7ae2938a63bcb711cba74,fix: resolve error if input file don't has extension
d1a6841c20d8880068bcce6bc71d9ccbe146403e,fix: inline assign in complex conditions (#699)
cc29da8e81e5bab534ad3d014e7162e1869d7ff6,build: fix release build
78eed8629cbe63702061c1292b01f975294f7b5d,"feat(gui): reopened tabs on file reload (PR #793 #792)

* Add getRealFullName() to ClassNode and JavaClass and searchJavaClassByRealName() to JadxWrapper

Those methods is like getFullName() and searchJavaClassByClassName(), but for class names without aliases.
It is necessary for renaming classes/methods/fields.

* MainWindow: Try to restore open tabs on deobfuscation toggle

Restore open tabs if possible when user toggles deobfuscation mode.
Try to scroll to the position before toggling deobfuscation mode (may be not exact cause of the comments)."
e3055b95f6cb108f0a836f31bdd16658c527f67b,"feat(gui): support for renaming methods, classes and fields (PR #794 #791)

* Add getRealFullName() to ClassNode and JavaClass and searchJavaClassByRealName() to JadxWrapper

Those methods is like getFullName() and searchJavaClassByClassName(), but for class names without aliases.
It is necessary for renaming classes/methods/fields.

* core: Make getFieldNode(), getMethodNode() and getRoot() public

This is necessary for renaming functionality

* jadx-gui: Add Rename popup menu entry (renames classes, methods and fields)

It allows user to rename classes, methods and fields.
It updates deobfuscation map and reload file.
This may be suboptimal, and maybe some RenameVisitor should be added.
Deobfuscation should be enabled in order to allow this."
7545625af4254bf745e89c107fa69e45b255392e,test: add NYI test for empty finally block (#789)
ef5da49bc0e07d92bdcef8c75dc1a0f1f94e7dc5,"fix(xml): reset nsMap in parse method (PR #798 #796)

Fixes injection of xmlns: attributes from other files (#796)"
1c6e51f8b2c6f7bbfd21c027bc8558f53cdfd908,fix: allow to regenerate class code (#791)
a2df92dd6811d3fe8851d034777a50ef5a79de4a,fix(gui): correct app close on menu exit action
f5d1f288d097ae19d42db34a4a2d0720234b96ed,fix: don't inline constants in synchronized statement (#799)
553f5b063f3275c8f36287213f88e20361fb39cc,feat(gui): add Messages_de_DE.properties (PR #804)
84211576e4d37c0d9998ba1aaeebf2e66369209b,fix(gui): add Deutsch to locales list (#804)
1568008c67a0907b2f3bea7679488b3f0f0cdfa5,fix(gui): improve Deutsch translation (PR #806)
c64ffde11fbf4fb2a76b16098f662acc90209a6a,refactor: use ICodeInfo interface instead CodeWriter
7f8d03d1927b95565938a4e2089f4cbed3417979,style: fix some sonar and compiler warnings
9ab003df4cb817d94e2cedb542c8d86833216827,feat(gui): map back and forward mouse keys for navigation (#807)
9c88f70740b7e8b326534afada316720f48a38a8,fix(gui): load file in background thread and show progress indicator
0c55ab9001232005da9ce37563b283289cf4c5a6,fix: resolve class cast exception introduced in CodeWriter refactoring (#810)
3b9b103c3ff591746a815a064ed4955a93e9caab,fix(gui): update Deutsch translation (PR #811)
af6f8b53911a02f3ad625e2702c478e0763074de,fix(gui): resolve exceptions during index (#812)
287275d8865ec13f5b2149ff136692b1cb0c449f,fix(gui): resolve --select-class option regression (PR #816)
99eb31b3125bc70b7d7c411a5b613e50d544fbc8,fix(gui): add dots for progress titles
04e309aeffedd8922fc6aae546f03a40404fa89b,fix: additional checks for 'if' blocks inside loops (#809)
f1e229193c13c071befc9ac5d8df66c282414622,fix: resolve exception on assign inline
0a9b94443157fc5a78152107f50bfd1eb04fcede,refactor(gui): add on finish runnable to open action
55eb86d2d56f2b4ef98cb94f8bec26ed490c5aa2,fix(gui): search class with --select-class also by not deobfuscated names
836585547502142dbdfdf4f3f73e273dcb49be59,fix(gui): search only in short names of methods and fields (#818)
02213802c5b3d7ea586feb21fc57126c1f7512da,fix: make correct replacement for synthetic constructor (#808)
9dd5a9ef89663344b66a528820f1e3cbeabdbf6b,"gui: More advanced implementation of renaming

This implementation does not reload file after renaming, and so works faster."
489fbb5e42243ca939eb529bcbd8fb6c714f33d6,"gui: Improve performance of renaming

Fixes multiple decompilation of classes - now each class decompiled just once."
797904afb5463559d9a427e78cbb3d88dfa281db,"gui: Perform refresh of non-displayed classes in background thread

After renaming some classes needs to be redecompiled to reflect new state.
Move recompilation of non-displayed classes to background thread.
This should improve performance on weak machines."
f90fc1d5ec8413cb9a4bcca03930e6c721fe4161,"core: ClassNode: Load recursively missing information on refresh()

Fixes loss of static identifiers, comments, annotations and source file name after rename."
df520a11341e0fa3a08ad339d44ac07baade46b5,"core: ClassNode: Check is field really static or not in loadStaticValues()

Fixes appearing of the 0/null/false initializers for instance final fields."
d346ed0570dcaea21d018877273e7fe6f640cc98,"core: MethodNode: Fix possible decompilation failure on refresh inner class

checkInstructions() may fail with NPE:
ERROR - NullPointerException in pass: BlockSplitter in method: com.google.common.primitives.Ints.IntArrayAsList.<init>(int[], int, int):void, dex: out.dex
java.lang.NullPointerException: null
        at jadx.core.dex.nodes.MethodNode.checkInstructions(MethodNode.java:159)
        at jadx.core.dex.visitors.blocksmaker.BlockSplitter.visit(BlockSplitter.java:49)
        at jadx.core.dex.visitors.DepthTraversal.visit(DepthTraversal.java:31)
        at jadx.core.dex.visitors.DepthTraversal.lambda$visit$1(DepthTraversal.java:16)
        at java.util.ArrayList.forEach(ArrayList.java:1257)
        at jadx.core.dex.visitors.DepthTraversal.visit(DepthTraversal.java:16)
        at jadx.core.dex.visitors.DepthTraversal.lambda$visit$0(DepthTraversal.java:15)
        at java.util.ArrayList.forEach(ArrayList.java:1257)
        at jadx.core.dex.visitors.DepthTraversal.visit(DepthTraversal.java:15)
        at jadx.core.ProcessClass.process(ProcessClass.java:41)
        at jadx.core.ProcessClass.generateCode(ProcessClass.java:58)
        at jadx.core.dex.nodes.ClassNode.decompile(ClassNode.java:292)
        at jadx.core.dex.nodes.ClassNode.decompile(ClassNode.java:271)
        at jadx.core.dex.nodes.ClassNode.refresh(ClassNode.java:303)
        at jadx.api.JavaClass.refresh(JavaClass.java:61)
        at jadx.gui.treemodel.JClass.refresh(JClass.java:63)
...

This happens because MethodNode.unloadInsnArr() call from BlockSplitter.visit() - after it instructions[] become null.
So, try to reload method before processing its instructions array."
15953f832f8863cdd141e04f81c872448be9701b,"core: Do not call addConstField() on class refresh - fix constants replacing

There is a duplicate control in the ConstStorage.ValueStorage.add() method,
so each constant should be added only once, and not be added on class refresh.

Fixes ""Replace constants"" failure after renaming any node."
6d4caca6cc46019ce66469171b918aa16f62b59e,"core: ClassModifier: Don't skip methods with SKIP_FIRST_ARG attr

Skipping those methods on class refresh leads to ""M.this = r1;"" like
assigments appears in the inner class constructors.

Unsure is this saint or not."
1e9b28b369e299e31a64a7f47e864d34d846ca4a,"core: AType: Add FIELD_INIT and SOURCE_FILE to SKIP_ON_UNLOAD set

Fixes disappearing litheral values for replaced constants in switches and source file names.."
610f531653fcfa7042de2f53c69d5a102ed91102,"core: EnumVisitor: Do not remove ACC_ENUM access flag

This flag is necessary for class refresh, and should be left there.
Fixes disappearing of enum fields after class refresh."
c72f2a2c9624194b81573b910dd7de59b8f5305e,"core: RenameReasonAttr: Do not append new reason if it is already there

Fixes possible ""reason: invalid class name and invalid class name"" comments after class refresh."
17cbb3eab0a725b7c9946ceda54dbeb9c639b29d,"core: Fix possible NPE in DebugInfoParser.addrChange()

This may happen because MethodNode.unloadInsnArr() call from BlockSplitter.visit() - after it instructions[] become null.
So, try to reload method before processing its instructions array and bail if insnArr still null even after reloading method."
1eca2b6cb0163e696c3f524bdba9c22b79dc8fe7,"core: ClassInfo: Do not ignore setting alias to original class name

Fixes trouble with renaming class back to its original name."
0c4b807caa7fa110dcfc06809d50f8ce519cfbbf,fix: improve ClassNode reloading and revert some changes
c97e5046867fc36a0887290b1b88150c27090009,fix: additionally show smali code of inner classes (PR #824)
9dbffef14044c78461f29cbee09bf1521eecbab9,"fix: deep reload for inner classes, const values and anonymous classes"
f3098741c3fb1f8eda352a4b62ed0d76151b919a,test: switch with fallthrough cases (#826)
531650c9f2f7dfc9021906f89a8eb22f582400a1,refactor: allow to change temp dir using system property JADX_TMP_DIR
7bbb083c36273cfef246a1ba5c8ca9c0a4e8bbaa,refactor: small changes to switch region and region debug print
2921c668349986ea802bd9e2c1c4a0cdc5b54a25,fix: replace constants inside annotations (#831)
c59887176445927f5c4632b189a80798a488ae84,"chore: official Gradle Wrapper Validation GitHub Action (PR #832)

See: https://github.com/gradle/wrapper-validation-action"
1047e751e68fe19406ddab00b8b5d53fe31aed60,chore: fix github action for gradle wrapper validation
5e7388f686684efd6514d770df85ba67feda7944,refactor: fix several issues reported by sonar
cd7e5bf02080a7d9e8d26f86f75088aa5cba0e09,Merge branch 'master' into rename
77fc6435a06523835488e1edb84343226aaa739f,"core: ConstStorage: Don't put known duplicate value to ValueStorage.values map

This is a microoptimization, which remove unnecessary values.put() and
values.remove() pair of operations if ValueStorage.put() is called for a
known duplicated value."
a0e13d0481be7c7fd0c9df7abdfa0d74c2be66ef,"gui: RenameDialog: Rename tmp deobf map file too

Fixes /tmp/deobf_tmp_*.txt temporary files accumulation on renames."
265a78cd2326269195402562a833247d0e06be91,"core: ConstStorage: Do not remove values from duplicates set in removeForCls()

If the constant already got duplicates - it will have duplicates even after
class reload, won't it?
But removing this constant from duplicates may break constants replacing
(just imagine a class TestClass with public static final int TEST_CONSTANT = 1;
 - after reloading TestClass each ""(int) 1"" litheral will be replaced to
""TEST_CONSTANT"" reference in each reloaded class and trivial increments will
become werid expressions (int y = x + 1; will become
int y = x + TestClass.TEST_CONSTANT;))."
467403362d1819acc96663e52dbeb2994f76aea4,"core: ConstStorage: Use ConcurrentHashMap for values map in ValueStorage

Exception in thread ""pool-9-thread-7"" java.util.ConcurrentModificationException
        at java.util.HashMap$HashIterator.nextNode(HashMap.java:1445)
        at java.util.HashMap$EntryIterator.next(HashMap.java:1479)
        at java.util.HashMap$EntryIterator.next(HashMap.java:1477)
        at jadx.core.dex.info.ConstStorage$ValueStorage.removeForCls(ConstStorage.java:61)
        at jadx.core.dex.info.ConstStorage.removeForClass(ConstStorage.java:100)
        at jadx.core.dex.nodes.ClassNode.deepUnload(ClassNode.java:290)
        at jadx.core.dex.nodes.ClassNode.deepUnload(ClassNode.java:295)
        at jadx.core.dex.nodes.ClassNode.reloadCode(ClassNode.java:284)
        at jadx.api.JavaClass.refresh(JavaClass.java:62)
        at java.util.concurrent.ThreadPoolExecutor.runWorker(ThreadPoolExecutor.java:1149)
        at java.util.concurrent.ThreadPoolExecutor$Worker.run(ThreadPoolExecutor.java:624)
        at java.lang.Thread.run(Thread.java:748)"
62ca30bbc61d51e062bd90cf74472a7596c4051e,fix: additional patterns to restore enum classes (#830)
08f9722e3309e8bc9dd715b7b97f52c1c70546d0,Merge branch 'master' into rename
bb0fad28349a655b4806c903413192cb6b39b719,fix: resolve multi-threaded unloading
0b6fabbc718921379e6b4cdac2cde85219d0b06f,"gui: Perform classes unload in the background UnloadJob

This should improve interface responsibility if there are many classes
to refresh after rename."
d98321026dcfe72dbf1a9b379ce2aac8e1039960,"gui: RenameDialog: Unload classes in refreshTabs() before refreshing

This should fix possible problems with incorrect refresh for open classes."
2107da2e1a1041a0b508b30fa5e3a41bec22b2de,fix: improve 'out' block detection in switch (#826)
49ce92f540ac36ac81728a86171a5385139e38fe,fix: remove move instructions with unused result (#835)
1bb90233b922e637d7ee52255085c525e72e971e,test: NYI tests for #836 and #837
1ce8fa8bdd4f3cf14206d7f5675b6c7e07ef7e08,fix: don't apply types if search failed (#840)
492a3f69287bd475bd9a99baad70997973d586a6,"feat(deobf): add classname parsing for Kotlin metadata (PR #842, #758)"
073fd76aa2c9015e02809aa549faa661d2ad1491,chore: update actions/checkout in gradle wrapper validation (#832)
5502d93cd57075c2fd810d38d80d040c39c674ee,fix: additional checks before insert move to help type inference (#843)
d0f197ea3d495ce3262b524b2ef90f24810fcae0,fix: shrink code if region maker add FORCE_ASSIGN_INLINE to insn (#845)
c24a3edb4489d008cd771c0f851fdc209b945f21,fix: inline assignment instruction from same block (#820)
bd0d248fd01d792076a8767788a3bf9aa09b5aa1,"fix: additionally show smali code of all inner classes (recursively) (PR #849, #848)"
4859629850c8aeefa7675e2376087902084ad5ed,"fix: record inlined classes and generate Smali code for them (PR #851, #848)

* fix: additionally show smali code of all inlined classes (recursively)
* variable name corrected"
fcb70e69c1e2158a253d130fb16b02b313c5fc8d,fix: don't print commented case value if it is an instruction (#850)
87320348dd3d6d7dc22207378c62309b359cef4f,chore: update all dependencies and gradle
57c28c61e035675763fd8b871f8586bf225262fb,fix: restore enum for several blocks in class init method
74b88b407e8f127080324a1073a101d359b058b2,chore: add config for lgtm.com analysis
dea7714ef3207b0f7e0e434d82998dbf20ae7e18,"feat: add methods information from standard library, improve generics and varargs restore (#836)"
519a74e8d27ae8e738a9f5b7fb940f91a91d3f9f,fix: improve type inference for arrays (#837)
1336c47d18d2c5f2e176e8c12c650d49afbb6205,fix: speed up switch processing by skip not relevant exits (#846)
e444ecb2c74869b7dfe23847d32f4c7559098734,fix: improve wildcard types compare (#857)
45207471678b39e3fbc7aa1c1f06ea85ef780568,fix: concurrent access may cause an java.lang.ClassCastException in JNodeCache (PR #864)
b56fd4d29adad5525136ba555a3082aa1aac7128,"chore: add inlined class name as comment (PR #865)

* chore: add inlined class name as comment
* chore: adapt unit test for inlined class name as comment"
fa0a38d3aafa4097d4a85831e97e78248fc8fb62,fix: don't use OS specific new line chars (#861)
26bad4a1cd797c886661a50f9376b8e03be282e8,fix: replace constants for arrays in annotations (#831)
49a82c83887839d126d195c3d34fc6801f3cbe32,fix: method info cache error (#868)
5eec8f754da9c18258023922998859a172a69272,fix: class resolving issues (#867)
89dbae8f8e0fd1b557b3c613d1dfc37d9f1ca5bb,fix: resolve NPE while compare outer generic types
3c7be5e9be814cd566bb4fc931f20b36325e93a3,"fix: use `super` instead `this` when `super` member is shadowed (PR #878)

* Added failing test for super member shadowing.
* Fixed new test containing incorrect variable names.
* Implemented marking super fields used in a subclass with super keyword.
* Renamed member variable in the example to reflect smali and test.
* Fixed formatting and imports."
37aecf72cb92744ec2ddda28b7809bfa2f2e2887,Merge branch 'master' into rename
f66ec9168cb308dee467b1c398f5eacb346265ab,test: update test TestAnonymousInline
c1f4302e6276386a5f785753fd84a5eb003ab0b1,"feat(gui): allow to search for full method/field signature, not only the name (PR #880)"
79ab2e11f8ad22b6e828276d50b826634ff943b9,chore(gui): preferences dialog changed to two-column mode (PR #888)
2cc49256a9abe370e28382c8f557ee3c3f12ea15,"chore(gui): optimized the text search for classes, methods and fields (PR #887)"
9d8066f4b80885fe973e31dc262d536bdbef1790,fix: don't remove synthetic methods from enum (#884)
2f780da305fdd2528c744d1188095152011f8084,fix: remove enum methods after instructions check (#884)
4cdad0e83e0369a82b1e9ed169a5a5d057bcf086,fix: correct method exit blocks collection (#876)
2da772df8ec7d5e1a69b36d7a5bb2b0da41bc917,fix: resolve some cases of switch in loop (#876)
dbd00d5a8b2a2d02138009012c9360280e2c4448,refactor: use instance methods for error and warning notifications
e09e933f9ca719c05d647367198878ddc70f02ac,fix: additional checks for class signature
a5ea560edc72c81b574ea2d83c473c6c53353780,fix: preserve code semantics on array-for-each transform (#893)
c62039f327c7cb0628b4ecd8a828c72f71293722,"fix(gui): use env %JAVA_HOME% as the JRE path (PR #895)

Co-authored-by: yunlong.yang <yunlong.yang@inveno.com>"
47dadf0a436f4e8f1cf47152bd63e4689503dd17,"fix: use correct class for Throwable, insert catch arg name if not defined (#896)"
315c07d4f68c33f1372d2cb8419cb8879f313794,feat(res): rename resources keys if contains unprintable chars or duplicates (#844) (PR #909)
